{
  "chunks": [
    {
      "children_ids": [],
      "content": "[A]\n\n# A\nhello",
      "end": null,
      "hash": "a917e520b4b98b449cce1f12831ea83523e69f99448258837847c026a708c0b6",
      "id": "chunk-0000",
      "metadata": {
        "breadcrumb": "A",
        "chunker_used": null,
        "extra": {
          "chunk_type": "header_based",
          "has_frontmatter": false,
          "markdown_header": "A",
          "markdown_level": 1,
          "raw_content": "# A\nhello",
          "section_index": 0
        },
        "header_path": [
          "A"
        ],
        "source": "input.txt"
      },
      "modality": "text",
      "parent_id": null,
      "size": 14,
      "start": null
    },
    {
      "children_ids": [],
      "content": "[A > B]\n\n## B\nworld\n### Deep\nstill B",
      "end": null,
      "hash": "b5bcd03b7c0ebe3ab4a69bc95905ac41bce20401bd64e205a9d9b4555c6a36e1",
      "id": "chunk-0001",
      "metadata": {
        "breadcrumb": "A > B",
        "chunker_used": null,
        "extra": {
          "chunk_type": "header_based",
          "has_frontmatter": false,
          "markdown_header": "B",
          "markdown_level": 2,
          "raw_content": "## B\nworld\n### Deep\nstill B",
          "section_index": 1
        },
        "header_path": [
          "A",
          "B"
        ],
        "source": "input.txt"
      },
      "modality": "text",
      "parent_id": null,
      "size": 36,
      "start": null
    }
  ],
  "params": {
    "breadcrumb": true,
    "chunk_by": "headers",
    "contextualize": true,
    "header_level": 2,
    "max_chunk_size": 8000,
    "min_chunk_size": 1
  },
  "schema": "chunking.v1",
  "source": {
    "name": "input.txt",
    "sha256": "3a120e0f07fa1765617519422c8ea1db7be69335bdb52684f1b38c170fe17a10",
    "size": 38
  },
  "strategy": "markdown_chunker"
}
