{
  "chunks": [
    {
      "children_ids": [],
      "content": "h1,h2\r\na,1\r\nb,2\r\n",
      "end": null,
      "hash": "7cde365a22407ad9380bc68ad97a3f490b01f7104de32a6a8c3fac675538c6d1",
      "id": "chunk-0000",
      "metadata": {
        "chunker_used": null,
        "extra": {
          "chunk_index": 0,
          "csv_end_row": 2,
          "csv_headers": [
            "h1",
            "h2"
          ],
          "csv_row_count": 2,
          "csv_start_row": 1
        },
        "source": "string"
      },
      "modality": "text",
      "parent_id": null,
      "size": 17,
      "start": null
    },
    {
      "children_ids": [],
      "content": "h1,h2\r\nc,3\r\nd,4\r\n",
      "end": null,
      "hash": "cfbe1868a44ffbc5d968143197aff7bdfdc80db29cf6c768b419188a3e8b79a0",
      "id": "chunk-0001",
      "metadata": {
        "chunker_used": null,
        "extra": {
          "chunk_index": 1,
          "csv_end_row": 4,
          "csv_headers": [
            "h1",
            "h2"
          ],
          "csv_row_count": 2,
          "csv_start_row": 3
        },
        "source": "string"
      },
      "modality": "text",
      "parent_id": null,
      "size": 17,
      "start": null
    }
  ],
  "params": {
    "chunk_by": "rows",
    "preserve_headers": true,
    "rows_per_chunk": 2
  },
  "schema": "chunking.v1",
  "source": {
    "name": "input.txt",
    "sha256": "b7655c26f9fb125ce9269c9c8c1d0cc5d5d84b29a4bfb95ad2f7e02dab52882d",
    "size": 22
  },
  "strategy": "csv_chunker"
}
