{
  "chunks": [
    {
      "children_ids": [],
      "content": "abcd",
      "end": 4,
      "hash": "88d4266fd4e6338d13b845fcf289579d209c897823b9217da3e161936f031589",
      "id": "chunk-0000",
      "metadata": {
        "chunker_used": "overlapping_window",
        "extra": {
          "chunk_index": 0,
          "chunker_used": "overlapping_window",
          "chunking_strategy": "overlapping_window",
          "overlap_with_previous": false,
          "unit_count": 4,
          "window_info": {
            "step_size": 2,
            "unit_type": "characters",
            "window_end": 4,
            "window_start": 0
          }
        },
        "offset_unit": "char",
        "source": "input.txt"
      },
      "modality": "text",
      "parent_id": null,
      "size": 4,
      "start": 0
    },
    {
      "children_ids": [],
      "content": "cdef",
      "end": 6,
      "hash": "9727bc3a31f5a09994a8408791a22db4b12502452e6e5d00a59a0ef8342b41cf",
      "id": "chunk-0001",
      "metadata": {
        "chunker_used": "overlapping_window",
        "extra": {
          "chunk_index": 1,
          "chunker_used": "overlapping_window",
          "chunking_strategy": "overlapping_window",
          "overlap_with_previous": true,
          "unit_count": 4,
          "window_info": {
            "step_size": 2,
            "unit_type": "characters",
            "window_end": 6,
            "window_start": 2
          }
        },
        "offset_unit": "char",
        "source": "input.txt"
      },
      "modality": "text",
      "parent_id": null,
      "size": 4,
      "start": 2
    },
    {
      "children_ids": [],
      "content": "efgh",
      "end": 8,
      "hash": "e5e088a0b66163a0a26a5e053d2a4496dc16ab6e0e3dd1adf2d16aa84a078c9d",
      "id": "chunk-0002",
      "metadata": {
        "chunker_used": "overlapping_window",
        "extra": {
          "chunk_index": 2,
          "chunker_used": "overlapping_window",
          "chunking_strategy": "overlapping_window",
          "overlap_with_previous": true,
          "unit_count": 4,
          "window_info": {
            "step_size": 2,
            "unit_type": "characters",
            "window_end": 8,
            "window_start": 4
          }
        },
        "offset_unit": "char",
        "source": "input.txt"
      },
      "modality": "text",
      "parent_id": null,
      "size": 4,
      "start": 4
    },
    {
      "children_ids": [],
      "content": "ghij",
      "end": 10,
      "hash": "975ca72b6bdf0e938bcc214727c939f7fc64109ee8f14add455a2364e8d1451f",
      "id": "chunk-0003",
      "metadata": {
        "chunker_used": "overlapping_window",
        "extra": {
          "chunk_index": 3,
          "chunker_used": "overlapping_window",
          "chunking_strategy": "overlapping_window",
          "overlap_with_previous": true,
          "unit_count": 4,
          "window_info": {
            "step_size": 2,
            "unit_type": "characters",
            "window_end": 10,
            "window_start": 6
          }
        },
        "offset_unit": "char",
        "source": "input.txt"
      },
      "modality": "text",
      "parent_id": null,
      "size": 4,
      "start": 6
    },
    {
      "children_ids": [],
      "content": "ij\n",
      "end": 11,
      "hash": "3119395a634a5ed58d3ea4a609d9e29e3dff5224bf9d870b348c3d4b14f62ad8",
      "id": "chunk-0004",
      "metadata": {
        "chunker_used": "overlapping_window",
        "extra": {
          "chunk_index": 4,
          "chunker_used": "overlapping_window",
          "chunking_strategy": "overlapping_window",
          "overlap_with_previous": true,
          "unit_count": 3,
          "window_info": {
            "step_size": 2,
            "unit_type": "characters",
            "window_end": 11,
            "window_start": 8
          }
        },
        "offset_unit": "char",
        "source": "input.txt"
      },
      "modality": "text",
      "parent_id": null,
      "size": 3,
      "start": 8
    },
    {
      "children_ids": [],
      "content": "\n",
      "end": 11,
      "hash": "01ba4719c80b6fe911b091a7c05124b64eeece964e09c058ef8f9805daca546b",
      "id": "chunk-0005",
      "metadata": {
        "chunker_used": "overlapping_window",
        "extra": {
          "chunk_index": 5,
          "chunker_used": "overlapping_window",
          "chunking_strategy": "overlapping_window",
          "overlap_with_previous": true,
          "unit_count": 1,
          "window_info": {
            "step_size": 2,
            "unit_type": "characters",
            "window_end": 11,
            "window_start": 10
          }
        },
        "offset_unit": "char",
        "source": "input.txt"
      },
      "modality": "text",
      "parent_id": null,
      "size": 1,
      "start": 10
    }
  ],
  "params": {
    "min_window_size": 1,
    "preserve_boundaries": false,
    "step_size": 2,
    "window_size": 4,
    "window_unit": "characters"
  },
  "schema": "chunking.v1",
  "source": {
    "name": "input.txt",
    "sha256": "c4f6fa010fb86ed9f99900dbf654759acd894604192042d5944f7c935ba41f2c",
    "size": 11
  },
  "strategy": "overlapping_window"
}
