{
  "chunks": [
    {
      "children_ids": [],
      "content": "The quick brown fox jumps over the lazy",
      "end": 39,
      "hash": "e79df309e6b0e98a1b677e5d47765063170fd0fbe136d305230dca2ca1ade525",
      "id": "chunk-0000",
      "metadata": {
        "chunker_used": "token_based",
        "extra": {
          "chunk_index": 0,
          "chunking_strategy": "token_based",
          "end_token_index": 7,
          "overlap_tokens": 0,
          "preserve_word_boundaries": false,
          "start_token_index": 0,
          "token_count": 8,
          "tokenizer_model": "gpt-3.5-turbo",
          "tokenizer_type": "tiktoken"
        },
        "offset_unit": "char",
        "source": "string"
      },
      "modality": "text",
      "parent_id": null,
      "size": 39,
      "start": 0,
      "token_count": 8
    },
    {
      "children_ids": [],
      "content": " the lazy dog. Token windows cut on",
      "end": 65,
      "hash": "89edf9cf1992a96e644023f7c583a3003521f433df97da2d61ea6c3c64231c45",
      "id": "chunk-0001",
      "metadata": {
        "chunker_used": "token_based",
        "extra": {
          "chunk_index": 1,
          "chunking_strategy": "token_based",
          "end_token_index": 13,
          "overlap_tokens": 2,
          "preserve_word_boundaries": false,
          "start_token_index": 6,
          "token_count": 8,
          "tokenizer_model": "gpt-3.5-turbo",
          "tokenizer_type": "tiktoken"
        },
        "offset_unit": "char",
        "source": "string"
      },
      "modality": "text",
      "parent_id": null,
      "size": 35,
      "start": 30,
      "token_count": 8
    },
    {
      "children_ids": [],
      "content": " cut on cl100k_base, not",
      "end": 82,
      "hash": "b97782c16ef30ae9c2c9c50735d6fe57e6ab065f9137785e1ccb8dd579d4258b",
      "id": "chunk-0002",
      "metadata": {
        "chunker_used": "token_based",
        "extra": {
          "chunk_index": 2,
          "chunking_strategy": "token_based",
          "end_token_index": 19,
          "overlap_tokens": 2,
          "preserve_word_boundaries": false,
          "start_token_index": 12,
          "token_count": 8,
          "tokenizer_model": "gpt-3.5-turbo",
          "tokenizer_type": "tiktoken"
        },
        "offset_unit": "char",
        "source": "string"
      },
      "modality": "text",
      "parent_id": null,
      "size": 24,
      "start": 58,
      "token_count": 8
    },
    {
      "children_ids": [],
      "content": ", not characters.\n",
      "end": 95,
      "hash": "f19c970f670b5b3b4bd47007669a4cf2146f211f785a2bc7b5228e66a46c8612",
      "id": "chunk-0003",
      "metadata": {
        "chunker_used": "token_based",
        "extra": {
          "chunk_index": 3,
          "chunking_strategy": "token_based",
          "end_token_index": 21,
          "overlap_tokens": 2,
          "preserve_word_boundaries": false,
          "start_token_index": 18,
          "token_count": 4,
          "tokenizer_model": "gpt-3.5-turbo",
          "tokenizer_type": "tiktoken"
        },
        "offset_unit": "char",
        "source": "string"
      },
      "modality": "text",
      "parent_id": null,
      "size": 18,
      "start": 77,
      "token_count": 4
    }
  ],
  "params": {
    "max_chunk_chars": 100000,
    "min_chunk_tokens": 1,
    "overlap_tokens": 2,
    "preserve_word_boundaries": false,
    "tokenizer_model": "gpt-3.5-turbo",
    "tokenizer_type": "tiktoken",
    "tokens_per_chunk": 8
  },
  "schema": "chunking.v1",
  "source": {
    "name": "input.txt",
    "sha256": "2997515194cfcad6ab7593fff8b6d85201455846a9ea4cde7db098bce4688815",
    "size": 95
  },
  "strategy": "token_based"
}
